{
  "$schema": "https://supramark.dev/schema/config.v1.json",
  "platform": "web",
  "features": {
    "gfm": true,
    "math": true,
    "footnote": true,
    "emoji": true,
    "admonition": true
  },
  "mermaid": true,
  "mathjax": true,
  "graphviz": "web",
  "echarts": {
    "charts":     ["Line", "Bar", "Pie"],
    "components": ["Grid", "Tooltip"]
  }
}
